{
  "testId": "validator.claimSignature.valid.created",
  "title": "Valid Claim Signature — c2pa.created Action",
  "description": "Verifies that a conformant validator correctly reports a valid claim signature for an asset signed with a c2pa.created action and a digitalSourceType. The signing certificate is self-signed (not on the C2PA Trust List), so signingCredential.untrusted is expected when trust-list validation is enabled.",
  "specVersion": "2.2",
  "inputAsset": "../../tests/fixtures/assets/Dog.jpg",
  "manifest": {
    "alg": "Ed25519",
    "claim_generator_info": [
      {
        "name": "crTool/0.3.0",
        "version": "0.3.0"
      }
    ],
    "title": "tc-created",
    "assertions": [
      {
        "label": "c2pa.actions",
        "data": {
          "actions": [
            {
              "action": "c2pa.created",
              "digitalSourceType": "http://cv.iptc.org/newscodes/digitalsourcetype/trainedAlgorithmicMedia",
              "when": "2026-01-17T14:44:19.231Z"
            }
          ]
        }
      }
    ],
    "ingredients": []
  },
  "signingCert": "../../tests/fixtures/certs/ed25519.pub",
  "signingKey": "../../tests/fixtures/certs/ed25519.pem",
  "expectedResults": {
    "validationStatus": [
      {
        "code": "claimSignature.validated",
        "explanation": "The claim signature must be cryptographically valid for an unmodified, correctly signed asset."
      }
    ]
  }
}
