{
  "testId": "validator.claimSignature.valid.createdAndEdited",
  "title": "Valid Claim Signature — c2pa.created then c2pa.edited",
  "description": "Verifies that a conformant validator correctly reports a valid claim signature for an asset that was first captured and then edited. Both actions are recorded in a single c2pa.actions assertion.",
  "specVersion": "2.2",
  "inputAsset": "../../tests/fixtures/assets/Dog.jpg",
  "manifest": {
    "alg": "Ed25519",
    "claim_generator_info": [
      {
        "name": "crTool/0.3.0",
        "version": "0.3.0"
      }
    ],
    "title": "tc-created-and-edited",
    "assertions": [
      {
        "label": "c2pa.actions",
        "data": {
          "actions": [
            {
              "action": "c2pa.created",
              "digitalSourceType": "http://cv.iptc.org/newscodes/digitalsourcetype/digitalCapture",
              "when": "2026-01-17T14:44:19.231Z"
            },
            {
              "action": "c2pa.edited",
              "when": "2026-01-18T10:22:15.123Z"
            }
          ]
        }
      }
    ],
    "ingredients": []
  },
  "signingCert": "../../tests/fixtures/certs/ed25519.pub",
  "signingKey": "../../tests/fixtures/certs/ed25519.pem",
  "expectedResults": {
    "validationStatus": [
      {
        "code": "claimSignature.validated",
        "explanation": "The claim signature must be valid for an asset with both c2pa.created and c2pa.edited actions."
      }
    ]
  }
}
